project_id,title,domain,start_year,outcome,data_link
MG-0003,Metal Alloy Solidification Study,Materials,2018,Refined microstructure,https://data.nasa.gov/...
MG-0001,Protein Crystal Growth of Lysozyme,Bio,2019,Improved crystal quality,https://data.nasa.gov/...
MG-0002,Combustion Flame Spread in Micro-g,Materials,2020,Lower soot production,https://data.nasa.gov/...
MG-0004,Cell Culture Response to Microgravity,Bio,2021,Different gene expression,https://data.nasa.gov/...
MG-0005,Zero-G Polymers Curing Kinetics,Materials,2022,Reduced void inclusion,https://data.nasa.gov/...